0002,2021-01-29 03:55:13,Water Data Lab,gspdrywells.com - a decision support tool to estimate well failure in critically overdrafted groundwater basins,Rich Pauloo; Amanda Monaco; Darcy Bostic,richpauloo@gmail.com; amonaco@leadershipcounsel.org; djbostic1@gmail.com,"Berkeley, CA; Fresno, CA; Topanga, CA","gspdrywells.com is an open source, data visualization web platform for understanding domestic well failure in the San Joaquin Valley across a range of groundwater level management scenarios, including minimum thresholds (MTs) set forth in groundwater sustainability plans (GSPs). ",Open source (components used to produce the result are freely available for distribution and modification),Identifying and Understanding What Makes Communities Vulnerable;  Analyzing the Impacts of Natural Resource Regulations and Policy;  Strengthening Data-Enabled Communication: Building Awareness and Engagement,"We use well completion reports from 943,469 wells from the California Department of Water Resources (https://data.ca.gov/dataset/well-completion-reports), seasonal groundwater level measurements (https://data.cnra.ca.gov/dataset/periodic-groundwater-level-measurements) from the year 2019 in the CA-DWR Periodic Groundwater Level Measurement database, and minimum thresholds reported at representative monitoring points specified in GSPs submitted in critical priority basins. Spatial boundaries for GSPs are provided by the GSP Map Viewer (https://sgma.water.ca.gov/webgis/index.jsp?appid=gasmaster&rz=true). 

This project builds off of work done by:
`function(water, data){science}` in the 2018 California Water Data Challenge (https://findanewway.ca.gov/2018/11/20/cawaterdatachallenge/)
Gailey et al, 2019 (https://link.springer.com/article/10.1007/s10040-019-01929-w)
Pauloo et al., 2020 (https://iopscience.iop.org/article/10.1088/1748-9326/ab6f10/meta), 
Bostic, et al 2020 (https://regionalchange.ucdavis.edu/publication/sustainable-whom-impact-groundwater-sustainability-plans-domestic-wells)
EKI 2020 (https://waterfdn.org/wp-content/uploads/2020/06/Groundwater-Management-and-Safe-Drinking-Water-in-the-San-Joaquin-Valley-Brief-6-2020.pdf)","This project supports scientific development, democratizes GSP data, and empowers affected communities. This project develops our understanding of the relationships between declining groundwater levels and the scale of well failure, as well as the costs associated with well failure. The easily downloadable data and decision-support tool allows GSAs, the state, and communities to understand this relationship and potentially create policies and programs to protect domestic wells. 

We would like to see this website used widely by community, GSAs, and the state. Already, Leadership Counsel has shared gspdrywells.com with two residents of impacted communities, with staff from the State Water Resources Control Board, and with approximately 15 environmental and social justice organizations. Ideally, communities within the assessed GSPs will be able to understand this component of their GSP and advocate for changes, if needed. Additionally, the methodology and code can be used by anyone currently developing MTs in their GSP boundaries. Finally, DWR can use this information to contextualize their assessment of GSPs in the San Joaquin Valley by understanding the range of options and impacts of 10 - 300ft of groundwater decline below present day levels. ","Our estimates of domestic well failure count, percentage, and cost agree with two other studies (Bostic, et. al. 2020 and EKI 2020), and suggest failure on the order of thousands of wells if groundwater levels fall to minimum threshold levels specified in GSPs. Unlike other studies, gspdrywells.com is web-based, and allows users to run adaptive management scenarios to plan for differing amounts of well failure, all in a web browser. Results suggest that planning and management actions can be taken now to address vulnerabilities before domestic well users lose access to water. With interactive data visualization and a dedicated “Data” subpage with downloadable datasets and model output, gspdrywells.com aims to democratize data and model access, and reduce friction in incorporating domestic well protection measures in the GSP process. 

The results of the project are incredibly timely for current groundwater management processes in the San Joaquin Valley. GSAs are currently starting to implement their Groundwater Sustainability Plans in the San Joaquin Valley. Advocates working alongside low income communities of color have been advocating for years for more protective groundwater management policies and impact mitigation programs. GSAs are often wary to establish impact mitigation programs because of a lack of clear understanding of the costs of such a program. With this tool, agency staff and stakeholders can more clearly understand how much it would likely cost to mitigate dry well impacts, and can more clearly see the financial tradeoffs between setting more protective minimum thresholds and mitigating dry wells. ","In the critically overdrafted basins examined in this research, we estimate significant domestic well failure if minimum thresholds are reached. On the order of 12-99% wells are projected to fail in individual GSAs, and well failure across all GSAs combined is estimated to be 61-63%, or 9,281 - 9,651 domestic well failures, at a cost of $109.2 - 115.8M. Well failure is most severe in areas where groundwater levels are already low due to historical overdraft, and where large concentrations of relatively shallow domestic wells are located.

Leadership Counsel has shared gspdrywells.com with two residents of impacted communities, with staff from the State Water Resources Control Board, and with approximately 15 environmental and social justice organizations. Residents of impacted communities were glad to see impacts on their drinking water access displayed in such a clear way, and plan to use gspdrywells.com to ask their local agencies for policies and programs that better protect drinking water access. Partner organizations applauded the tool and its interactive features, and have used it to help show the State Water Resources Control Board how widespread and severe the impacts to drinking water access will be in the San Joaquin Valley, and urge the SWRCB’s action to avoid these impacts. Leadership Counsel and two other partner organizations have designed a presentation to GSAs that uses the tool to show local impacts in the GSA area and ask for measures to protect drinking water access. 

All data, code, and methods are available on gspdrywells.com and are easily downloadable. Methods can be used by consultants writing GSPs to assess well failure across many different groundwater decline scenarios, thus simplifying planning and management hurdles that rely on the development of costly well failure models. Municipalities, water districts, and other users of public supply wells can compare their well depths to MTs in their region and perform a localized analysis. The Water Board and DWR can use this tool to assess GSPs in terms of their consideration of the Human Right to Water (HR2W) and ‘significant and unreasonable’ impacts of MTs.","We faced methodological challenges in reading and scraping minimum threshold data from PDFs of submitted GSPs, as well as technical challenges in designing and coding a web interface. We decided to move away from the traditional server-UI model, for a JAMStack style static site which reduced loading time, increased site security, and is generally much easier to serve to multiple people at once (better load balancing).

Buy-in from state and local agencies would help scale the project’s impact. We aim to reduce the friction in integrating well protection planning into the GSP framework. We focused on critical priority basins because well failure is expected to be the highest here, and because these GSPs were already written. Moreover, we emphasized domestic wells because these tend to be the most shallow. In the future, we would like to expand our work to encompass public supply wells, and in medium and low priority basins. We believe that by continuing to develop these tools, we will help realize the Human Right to water for underserved Californians in groundwater-dependent regions.

To achieve these goals, additional funding is needed. One potential funding model would include a consortium of participating GSPs who jointly fund the development of these tools, and who share updated MO and MT data as it becomes available to keep the tool up-to-date.",@RichPauloo; @AmaM0na; @darcybostic,"2021-01-30_09-43-27_Trim.mp4
Water_Data_Lab_Team.docx",checked,51.0,25.5
0001,2021-01-27 17:58:49,CA Open Water,sdwisard - an open source query tool for SDWIS,"Rich Pauloo, Sadie Gill, Emanuel Rodriguez","richpauloo@gmail.com, sgill@flowwest.com, erodriguez@flowwest.com","Berkeley, Sacramento, Sacramento","The sdwisard R package is an easy-to-use, open-source query tool for California drinking water quality data in the SDWIS database that enables reproducible analysis.",Open source (components used to produce the result are freely available for distribution and modification),Improving the Quality and Usability of Our Data and Metadata,We used California's SDWIS database (https://sdwis.waterboards.ca.gov/PDWW/). This is entirely new work.,"The sdwisard R package is an easy-to-use, open-source query tool for California drinking water quality data in the SDWIS database. Analysts can use sdwisard to create reproducible, open-source workflows that rapidly and programmatically acquire machine-readable, pre-cleaned, drinking water quality data. Our goal is to demonstrate a modern and reproducible data workflow centered around APIs, databases, and code. 

We aim to shift the conversation about data warehousing towards the use of modern API infrastructure by demonstrating what can be done if this infrastructure were already in place. An API wrapper is but one example. With a SDWIS API in place, any web service, researcher, or analyst could make requests for data from that API. Thus, sdwisard presents a case for a SDWIS external API, and also provides a tool that analysts, data scientists, and researchers can use today to improve the reproducibility of their workflows. Because the tool is open source, anyone can improve this tool and contribute to our CA Open Water Github organizational profile.","In California, present sources of water quality information are fragmented across thousands of water utilities and lack consistency and clarity. Moreover, although the state has identified open and transparent water data as critical to inform water management and achieve goals set in Human Right to Water, analysts remain hampered by a paucity of easy-to-use, open-source tools to acquire and analyze water quality data.


Sdwisard demonstrates the utility of easy-to-use API wrappers that empower analysts to get more done with data with less effort. Because the tool is open source, anyone can improve this tool and contribute to our CA Open Water Github organizational profile.","We developed a website for the v0.1 release of the sdwisard software (https://caopenwater.github.io/sdwisard/index.html), that includes installation instructions and a getting started vignette that explains how to use the tool. The github page with the R code for this project is here: https://github.com/CAopenwater/sdwisard, and the source code is available under the Creative Commons License: https://caopenwater.github.io/sdwisard/LICENSE.html","SDWIS does not have an API. We wanted to demonstrate why an API is important by developing one example of a tool (e.g., sdwisard) that could exist if the API was real. How do you build a query tool without an API? The answer, is to build a faux-API and a query tool around that faux-API. We used an s3 bucket on Amazon Web Services to host clean SDWIS data, and designed sdwisard to operate as if it were querying a real API. If and when the SDWIS API becomes a real thing, it will be relatively easy to direct the endpoints in sdwisard towards the real API.

To scale our project for greater impact, we need a real-life SDWIS API and the broad use of sdwisard as a tool for fetching SDWIS data. Before the API is built, we need resources to pay for requests that people make to the s3 bucket where data is currently hosted (these costs are minimal, but could become significant if the tool was broadly used).","@RichPauloo (Twitter, github), @thesadie (github), @ergz (github)",sdwisard_intro.docx,checked,43.0,21.5
