0008,2021-02-01 21:37:39,"GreenInfo Network, Community Water Center, UC Berkeley – Water Equity Science Shop (WESS)",Drinking water vulnerability tool,"GreenInfo: Gregor Allensworth, Amanda Damewood, María Lamadrid, Dan Rademacher, Tim Sinnott, Stephen Smith, Maianna Voge, Yessenia Chaiu Zhang. Community Water Center: Susana De Anda, Laurel Firestone, Natalie Garcia-Grazier, Ryan Jensen, Heather Lukacs, David Okita, Debi Ores, Adriana Renteria, Anavel Valdez-Lupercio. Amanda Fencl, Rob Gailey. UC Berkeley: Carolina Balazs, Kallista Bley, Lara Cushing, Jessica Goddard, Rachel Morello-Frosch, Clare Pace, Jenny Rempel",gin@greeninfo.org,"GreenInfo based in Oakland, California. Community Water Center based in Sacramento, California. WESS is based in Berkeley, California","A web-based application, https://drinkingwatertool.communitywatercenter.org/,  that puts key water data at the fingertips of the community, so members can explore, understand, and advocate for the safety of their water supplies, with a focus on wells and community water systems that serve populations less than 10,000.",Mix of Open Source & Proprietary,"The drinking water vulnerability tool focuses on the water data challenge of “Identifying and Understanding What Makes Communities Vulnerable.” The project shows that vulnerability is multi-faceted and can be analyzed at different spatial scales like county boundaries, Groundwater Sustainability Agency (GSA) boundaries, or well locations.  An estimated 1.5-2.5 million people in California rely on unregulated water sources (e.g., wells). These groups face two main vulnerabilities: (1) Vulnerability to water quantity changes: persistent droughts can lead to water scarcity. (2) Vulnerability to water quantity issues: lack of regulation and mobile cancer-causing contaminants (e.g., nitrates and arsenic from agriculture or industrial processes) can contaminate wells.   These vulnerabilities are further compounded by socio-economic constraints which can sometimes compromise all access to water. This project fits in the broader California Data Challenge scope of “Assessing What We Know,” since it brings together a myriad of spatial data from many different California-based organizations to better understand different types of vulnerabilities. The tool helps communities better understand the locations of populations that may be affected by drought and water contamination.","Detailed descriptions of the different data layers can be found here: https://drinkingwatertool.communitywatercenter.org/data/

This list is a brief overview of the data layers and source or reference. We used a range of CA.gov resources, including water.ca.gov, data.cnra.ca.gov, oehha.ca.gov, and others.

GSA boundary: California Department of Water Resources SGMA Data viewer
Groundwater depth: CDWR Groundwater Information Center Interactive Map Application
Groundwater basin prioritization level and critically over drafted indicator: SGMA Data viewer

Boundaries and Demographics
County, Assembly District, Senate District, Alluvial
2010 US Census
Public Land Survey System 
Race, ethnicity, median household income, disadvantaged community status etc. for place, tracts and block groups
U.S. Census Bureau, 2013-2017 American Community Survey 5-Year Estimates.

Wells and Drinking Water Systems

Municipal or public supply wells 
Department of Water Resources’ Online System for Well Completion Reports 
Gailey, R. (2019) Public Supply Well Locations. CWC Drinking Water Tool.

Private Well Locations 
Department of Water Resources’ Online System for Well Completion Reports
Pace, C., Balazs, C., Cushing, L., Morello-Frosch, R. (2019). UC Berkeley Water Equity Science Shop. Domestic Well Community Boundaries Version 1.0.

Community water system boundaries 
Tracking California Water System Service Areas Tool
Pace, C., Balazs, C., Cushing, L., Morello-Frosch, R. (2019)  UC Berkeley Water Equity Science Shop. Community Water System Boundaries.

Water Quality (arsenic, nitrates, chromium, 1,2,3-Trichloropropane) 
California Office of Environmental Health Hazard Assessment’s (OEHHA) CalEnviroScreeen (CES) 3.0 dataset
Pace, C., Balazs, C., Cushing, L., Morello-Frosch, R. (2019)  UC Berkeley Water Equity Science Shop. Community Water System Boundaries- Water Quality. Pace, C., Balazs,
C., Cushing, L., Morello-Frosch, R. (2019)  UC Berkeley Water Equity Science Shop. Domestic Well Community Boundaries- Water Quality, Version 1.0.

Some datasets are results of calculations on the datasets. For example, to understand the drought scenarios, the groundwater depths from 2012-2016 are scaled by 0.5, 0.75, 1, where 1 represents the worst drought. Additional description of data and methodology can be found https://drinkingwatertool.communitywatercenter.org/data/

For technology, we built on Wordpress and Django, two widely used open source web platforms. Wordpress allows for flexible content editing and access to a wide range of plugins. Django integrates with Postgres/PostGIS for spatial reporting. We use a range of other open source tools, including Leaflet.js, Bootstrap.js, and Mapserver.","The first goal is educational. The tool enables users to learn and discover their water supply system. With a simple interface, the first tool just requires an address. This information allows the user to learn who manages water in their neighborhood and describes the different agencies that may be involved (community water systems, GSAs). This section is informative for users to learn about maximum contaminant levels, consumer confidence reports, and more generally get involved with local water issues.

The second goal is exploratory. With the web mapping tool, users can dive deeper into California's many water data layers. Different users can use the data to learn about water quality and water supply. 

This project is a collaborative, creative, and transparent effort to understand water vulnerability particularly with respect to wells in California. With access to the data, the user can quickly identify many types of vulnerability. For example, the user can explore spatially which community water system is serving disadvantaged communities (socio-economically vulnerable). The user can learn where declining groundwater elevations due to droughts can affect water access (vulnerable to water quantity changes). The user can understand where people are affected by different contaminants (vulnerability to water quality).

The tool has features for many different types of users. Policy and decision makers can use the tool to review groundwater sustainability plans and plan for drought resilient communities. Researchers can quickly download the data to run their own analysis. Residents can enter their addresses and find out who supplies their water.","There are many unique features to this project and three to highlight include:

1 - Combining both water quantity and water quality data into one tool showcases the different types of vulnerabilities that can exist and treats water more holistically.

2 –  The entire system is available in both English and Spanish. In a moment where society aims to understand how to be inclusive, particularly when discussing vulnerable communities, the Drinking water vulnerability tool has started to make inclusion a central part of data and design by accommodating the second-largest language spoken in the state (Spanish ~25%).

3 – The tool offers features along a wide range of use cases, from the simple educational information of who provides water at a specific address to the deeper-dive of many data layers combinations and research questions, the tool can serve a very broad group of people and help them better identify water vulnerabilities for others and for themselves.","The tool has been used by the Community Water Center’s staff for both community organizing and legislative advocacy. At launch, the tool was covered by Capitol Public Radio (http://www.capradio.org/articles/2020/02/13/california-may-be-sliding-back-into-drought-lawmakers-and-advocates-warn-now-is-the-time-to-prepare/) and KSBW TV in Monterey (https://www.ksbw.com/article/new-online-interactive-tool-helps-californians-prepare-for-future-drought/30900500#).

Residents in places like Twentynine Palms and Ventura can quickly see their water systems have high levels of Hexavalent Chromium (cancer-causing) contamination. Anyone with a domestic well around Chino can learn about risks of high nitrate levels. And residents of the Sacramento Valley can see how their GSAs face higher costs for domestic well remediation than elsewhere in the state.

Drought scenarios are applied in the Central Valley and we can see the impact of increasing drought severity in Fresno, Merced, and Modesto. These cities are already in critically overdrafted basins. By looking at the GSA level scale we can see how the number of impacted domestic wells changes with different scenarios with both Merced and Modesto reaching number of impacted wells at more than 26 the highest category at scenario 100% and Fresno already having this designation at the scenario 50%. With respect to quality, we can explore Arsenic near Mercer where it is present in both community water systems and to a greater extent in groundwater private domestic wells. Atwater just north of Mercer seems to have 1-2-3 Trichlorpropane contamination in both community water systems and in private domestic wells at levels more than 200% the MCL. This area is predominantly Hispanic/Latinx. 

Exploring Atwater offers insights on the relationship between vulnerability and equity since the user can compare the areas that have regulated community water systems and associated 1-2-3 Trichloropropane levels and the surrounding unregulated domestic wells and their associated contamination. Furthermore, the stark distinction in income suggests part of the difference may be socio-economic.","Three challenges during the project included:
1 – Aggregating wells to comply with privacy concerns.  Although well data was often available at higher resolution, it was important to aggregate well to US Public Land Survey Systems. This also enabled a calculation of likelihood that an area was served by a well when no well location was available.

2 – Identifying the right audience. One of the difficulties is identifying who the audience and users of the tool will be. This project aimed to build a tool for the general public, but this group may include advocates, policy-makers, researchers. This requires designing different features for different users. Consequently, building something for a general public is the most complicated tool of all to build!

3 – Developing a clear, consistent, and agreed-upon measure of a “safe” or “vulnerable” would make a tool like this much easier for the general public to understand. Without that definition, it’s impossible to present a truly simple and immediately actionable message around “how safe is my water?”","Twitter: @greeninfo, @CWaterC, @SHE_Lab__","Water_Data_Challenge_Final.mp4
WaterDataChallengeFigs_01022021.png
Atwater-English.png
Atwater-Spanish.png",checked,57.0,28.5
0007,2021-02-01 18:38:11,PFAS Away,PFAS Analysis and Intervention,"Melissa Salazar, Albert Chavez","msalazar@mnwd.com, albertulysseschavez@gmail.com","Aliso Viejo, CA, San Jose, CA","Bringing awareness to and analyzing a newly researched class of chemicals, PFAS.",Open source (components used to produce the result are freely available for distribution and modification),"This project is focusing on Strengthening Data-Enabled Communication: Building Awareness and Engagement. PFAS, or per and poly fluoroalkyl substances is a class of over 4,000 chemicals. Although they have been used since the 1940’s, it is not until recent years that regulations in drinking water have begun. The CA State Water Board began monitoring PFAS in drinking water in the UCMR 3 which then led to quarterly testing in 2019. With this new research and testing comes new data in which we need to analyze.","The project’s data is as follows:
Quarterly PFAS Testing 2019: https://www.waterboards.ca.gov/pfas/drinking_water.html
EDT Library, a combination of three tables - chemical, siteloc, storet: https://www.waterboards.ca.gov/drinking_water/certlic/drinkingwater/EDTlibrary.html
Landfill Data: https://www.epa.gov/lmop/project-and-landfill-data-state
CA DTSC Hazardous Waste Sites: https://www.envirostor.dtsc.ca.gov/public/search?cmd=search&reporttype=CORTESE&site_type=CSITES,FUDS&status=ACT,BKLG,COM&reporttitle=HAZARDOUS+WASTE+AND+SUBSTANCES+SITE+LIST+%28CORTESE%29
CA Military Sites: CA Water Boards website, link no longer available.
This project is a continuation of the PFAS– We Eat It, We Drink It, We Breathe It project. This project was made possible through a few datathons in 2019, as well as a proprietary test dataset that has since been published. We took the data format from last year's PFAS project and modeled this year's data after it.","The goal of this project is to bring awareness as well as reduce time taken to analyze the data. Although data analytics is a growing field, many water providers may not have the personnel to analyze their test data. With the PFAS Analysis and Intervention Application a user can upload their test data to analyze or look at prior efforts test data.
We have also created a data warehouse using Google BigQuery, to create a dedicated location for our open-source project to pull from actively. The impact of having a dedicated area with reliable data pipelines is the data will be easily updated and available to be used for anyone.","Our approach is different because we have gathered, transformed, and made a unique data store that is meant strictly for our application. This application not only analyzes publicly available data, but it can analyze user inputted data. The topic of PFAS is still widely unknown thus why it is compelling. PFAS notification and response levels in drinking water were first set in 2018 and in 2020 the response level was lowered as the PFAS statewide investigation continues.","The project leverages historical precipitation data from NOAA, as well as spatial data to visualize what possible sources of PFAS could be in the vicinity of a test site. For some test sites, the precipitation data shows a spike in precipitation, and in the following days, the test data shows a spike in some PFAS levels. Recognizing this pattern can lead to wanting to know if there are landfills in the area causing PFAS leaching. The app provides the necessary precipitation data as well as the landfill locations to this type of analysis.  
If the precipitation data does not spike when there is a rise in PFAS levels, what is the cause? This pattern is the reason why there are other location points such as military sights and DTSC hazardous waste sites also plotted in the vicinity of the test site to possibly identify the source.

The working application is hosted on shinyapp.io: https://meldataaa.shinyapps.io/PFAS_Analysis_and_Intervention/

The GitHub repository can be accessed here: https://github.com/meldataaa/PFAS_Analysis_and_Intervention","One challenge we faced early in the project was transforming the data. The data was originally only available in DBF format. We tried to transform the data, but the resulting files were still somewhat corrupt and needed extra cleaning. Luckily, the database files are now available in CSV format, which is easier and more comfortable to use. 
From a data perspective, data is not always readily accessible. Locating the correct data takes the most time. For a while, we could not find the supporting data we needed to complete a feature of the application. We even considered stopping the project. In November, the data we needed was posted, and we started up work again.
The precipitation data is hosted on the National Climatic Data Center which can often be slow and unreliable. When testing the application, we often thought there were issues with the app but the NCDC server was down. If the NCDC server is down the application may not function properly.

For a more significant impact to occur, we would need: 
All publicly available data on a server that is easily queriable to avoid having to periodically download the needed data as well as avoiding the location of data from changing.
Marketing and user research to ensure people know about our project.
More data resources to expand outside of California.",@meldataa,PFAS_2021.mp4,checked,39.0,19.5
