Title,Water Data Challenge 2020-2021: Last Updated,Water Data Challenge 2020-2021: Individual or Team/Group Name,Water Data Challenge 2020-2021: Project/Innovation Title,Water Data Challenge 2020-2021: Team members' names,Water Data Challenge 2020-2021: Email addresses for each team member,Water Data Challenge 2020-2021: City/State of residence for each team member,"Water Data Challenge 2020-2021: One sentence or phrase that describes the essence of your project, product, or innovation",Water Data Challenge 2020-2021: Our entry is:,Water Data Challenge 2020-2021: What challenge question / problem statement are you focusing on?,Water Data Challenge 2020-2021: What data did you use? What resources or prior work are you leveraging?,Water Data Challenge 2020-2021: What are your goals and anticipated impacts?,Water Data Challenge 2020-2021: What makes your approach unique or compelling at this moment?,"Water Data Challenge 2020-2021: Please share any meaningful project results or insights, thus far.","Water Data Challenge 2020-2021: What were some of the (technical and other) challenges you tackled? In your opinion, what would it take to scale your project for greater impact?","Water Data Challenge 2020-2021: Social media handles, hashtags","Water Data Challenge 2020-2021: Submit your entry, including a 2 minute overview video.",Water Data Challenge 2020-2021: I am over 13 and have the permission of a parent or guardian to participate in this activity.,Review 1: Review + Awards: Total Score,Review 1: Review + Awards: Average Score
0011,2021-02-03 20:58:31,Brown Mundes,Purify,"Ansh Motiani, Adi Gupta, Samhith Kakarla","anshmotiani47@gmail.com, adisguptag@gmail.com, samhith.kakarla@gmail.com","Massachusetts, North Carolina, North Carolina",Clean Water Discrimination: The Native American Water Crisis,Open source (components used to produce the result are freely available for distribution and modification),Comparing the impacts of water regulation and policy in Native American communities with Non-Native communities,"Initially, we tried to access data from the California USGS, but it did not provide the information that we needed. As a result, our project revolved around EPA Enforcement and Compliance History Detailed Facility Reports for Native American and Non-native areas. This outlined water quality violations for each location and provided insightful data that we used to create our interactive map and visualizations. We utilized web-scraping and their API to get access to the information we needed.

In addition, we used Census data to find the latitude, longitude, and zipcodes of each community, so we could best display them on our map.

While most of our backend work has been done from scratch, our website took inspiration from a previous California Water Data Challenge winner, http://calwaterquality.com/.","With our interactive tool, we hope to raise awareness for the major water quality issues present in Native American communities, not just in California, but throughout the western United States. The ability to compare Native American water quality with nearby non-native communities highlights the growing divide in access to clean water. Even when they are in the same geographical areas, Native American communities often have poorer water quality than Non-native communities. Our team hopes to bring this often overlooked issue to the fore.

We want our findings to inspire and fuel actions to protect these disadvantaged Native American communities and bring about change. We plan to present our findings to state and local governments to give a voice to a suppressed population.","We approached this broad water quality problem by focusing on a specific community that is in need of help. Often times, Native American difficulties and struggles are overlooked by others. We want to change that. By narrowing the focus of our project, we were able to have a more direct and substantial impact in the area of our research. 

While there are many tools to explore water quality in states such as California, we could not find any that had a specific focus on Native American Communities. In addition, none of the tools we came across had an option to compare the water quality of a certain place with nearby communities. Our Relative Quality Reports allow the user to do this. This provides a context for the results and data presented, and it highlights the major problem of clean water discrimination.","This is the most shocking statistic we came across in our findings: Native American communities are 30% more likely to have water quality violations than Non-Native communities. They also have a significantly higher chance of their violations going unaddressed and continuing to pose a threat to the local population. 

We outline and display all of these statistics and figures on our website and include many interactive visualizations to show a certain place’s frequency of specific contaminant violations (includes the names of contaminants), number of addressed and unaddressed violations, and a scatterplot comparing the Native American community to nearby non-native communities. Others can easily take our findings and use them to gain insight into certain communities and improve upon our work.

We also plan to make our cleaned data sets available on our website so others can use this data for their own purposes and bring further insight into this topic.","Being high school students, one of the biggest problems was finding time to work on this project. In between all the tests and quizzes, we pulled all-nighters to turn our idea into a reality, and it was definitely worth it.

Along with that, we also lacked major experience in the field of Data Science. While we, the team members, have taken courses and done research internships focused on Data Science, we had never gone out and done a project on our own, without any guidance from mentors or teachers. It was both a blessing and a curse: we learned to become independent and picked up skills that will last a lifetime, but also went through hours and hours of Stack Overflow and hectic Google searches :). 

In addition, a lot of the software we used was the “trial” or “basic” version, so we were limited by our resources. One example would be the Plotly visualization library. We had around 500 plots to display, but our API calls were limited to 100, so we had to create multiple accounts and continuously change our functions in order for the code to work.

Lastly, and most importantly, a lot of data was missing, so we had to manually input it. In situations where web-scraping wasn’t an option, we opened up the data sets ourselves and combed through each and every row to make sure we had as much quality data as possible. Our process involved a lot of data cleaning and improvement.

Now that we have the quality data, with access to better resources, we can easily scale our project.","Instagram: @ansh_motiani, @aditya10g, @samhith.k, #nativeamerican #water-quality #cleanwaterdiscrimination","Purify_Overview.mp4
Link_to_website.pdf
Project_proposal_1.pdf",checked,48.0,24.0
0010,2021-02-01 23:32:50,Upwardly Innovations,Surface Moisture Monitoring in Real-Time and Large Scales,"Frankie Ridolfi and Steven Hamann, PhD","frankie@upwardly.work, shamann@quaestainstruments.com","Oakland, CA (Frankie), Tucson, AZ (Steven)","Our innovation is a real-time data collection method for field-scale (and larger) sensing of soil moisture, snowmass, and vegetation that may be used to ground-truth, calibrate, complement, and augment the current methods of estimating surface water data at these scales -- critical inputs for water markets and implementation of the SGMA, including the soon to be unveiled OpenET (evapotranspiration) platform which uses estimates from satellite imagery, not proximal measures.",Mix of Open Source & Proprietary,Improving the Quality and Usability of Our Data and Metadata,"We used soil moisture data measured by single and networked sensors. We are leveraging over 13 years of technical development and field testing with universities, U.S. government labs and agencies, and commercial agriculture. Quaesta Instruments is a scientific firm that provides surface moisture sensing hardware systems and web-accessible data streams.

The surface water data we’re collecting is generated by these above-ground systems, which use proven cosmic-ray sensor (CRS) network technology that offers many advantages over existing methods. For example, one “box” placed on an irrigation pivot can continuously stream soil moisture data as it sweeps in a circle across a field, creating high resolution maps. 

These sensor networks (one sensor per field) make it practical to monitor water volume in soils, snowmass, and vegetation over very large areas to improve irrigation efficiency, monitor water supply, assess flood and fire hazard, and inform climate models.","Our goal is to introduce Cosmic Ray Sensor (CRS) data to the open water community, which likely is not aware of its existence, and begin an exploration of how it can improve water data quality and analysis and support wiser water management and public policy. 

Moisture at the land surface in the form of soil moisture, snow and vegetation water is critical to humans. Snowpack is important for water supply in most western states, and snowpack and soil moisture directly affect forests, weather and climate. Vegetation moisture content can help predict the effects of drought on crop yields and the likelihood of wildfire, and soil moisture and snowpack are important in predicting floods and landslides. Given the importance of surface moisture to our society, it should be well understood. But it is not. Spatial estimates of surface moisture are poor. 

We hypothesize that CRS data will help farm managers immediately make water use adjustments. For example, a web portal enables farmers to see their fields' soil moisture data in real-time and easily assess whether, when, and where it makes sense to irrigate or to conserve.","As the State of CA prepares to deploy water markets and data platforms to support them over the next few months, it’s a singularly important time to confirm that the data being used are reliable and usable as possible. We believe analysts and program leaders will be eager for an additional and independent data source that may help improve coverage, improve representativeness in space and time, reduce measurement errors, and support standardization and harmonization of data. Demonstrating the applicability of this data type and collection method may also prove a model for how large-scale surface water assessments can be conducted statewide, and as a model across the nation.","Academics evaluating our innovations have published numerous papers, which may be a good source for others wishing to reproduce that work and build on it from a technical and policy point of view. More importantly for the spirit of the Water Data Challenge, we wish to encourage innovation transfer now to policy makers, commercial agriculture, and community stakeholders.","Typical irrigation practices lack a data-driven feedback mechanism on field saturation -- water is simply turned on and off at certain times, or as a farmer chooses. This is exceedingly wasteful. Most soil moisture systems require the deployment of probes stuck into the ground. This approach is expensive to scale, hard to reconcile with farming operations (wires and ploughs do not mix well), and provides only point-sources of data which are inferior and even misleading because fields are not homogeneous -- a probe can only measure the soil it is immediately touching. 

The use of cosmic-ray sensors is a major innovation for monitoring soil moisture. They are cheap to scale (one per field, easily networked), can be mounted on equipment and vehicles to avoid interfering with farming operations, and data are highly accurate because the technique remotely senses the entire field repeatedly, providing high resolution heat maps, time series, and transects.

This technique makes it practical and more cost-effective to monitor soil moisture (a critical factor also in monitoring groundwater), vegetation water equivalent (plants in a field), and snow water equivalent all via open-source web distribution for analysis at multiple scales, from individual fields to drainage basins to regions comprising the entire State of CA. Such a data stream would be a valuable resource for county governments, water utilities, agriculture areas and farms, and well as colleges, universities, high schools, and middle schools (STEM education).",#upwardly-innovations #quaesta-instruments,,checked,28.0,14.0
0009,2021-02-01 23:17:18,Illuminare,Well-Known,"Justin Ziniel, Michael Lutz","ziniel.1@osu.edu, mlutz0717@gmail.com","Denver, CO (Justin) and Los Angeles, CA (Michael)","We combine census data with groundwater quality data to provide a high-resolution map that helps answer the question ""how do social, economic, and employment factors impact groundwater quality?"".",Open source (components used to produce the result are freely available for distribution and modification),How might we identify and understand the multi-faceted issues that communities with limited or unstable access to water resources face?,"We employed several sources of data, including:
- Water Quality Portal data from the National Water Quality Monitoring Council (https://www.waterqualitydata.us) for groundwater test data for inorganic and organic contaminants
- Area Deprivation Index (ADI) data from the University of Wisconsin School of Medicine and Public Health (https://www.neighborhoodatlas.medicine.wisc.edu) to quantify disadvantaged neighborhoods
- 2015-2019 American Community Survey (ACS) data from the US Census Bureau (https://www.census.gov/programs-surveys/acs) for demographic information
- Cartographic data from the US Census Bureau for spatial boundary information",Our goal is to provide a prototype approach of how researchers might quickly sift through large volumes of demographic and water quality data to identify important correlations that warrant further analysis/study.,"We believe that overlaying census and water quality data in a single geospatial plot, in addition to calculating important summary statistics on-the-fly, represents a novel approach to gaining insight into how water quality and population demographics interact at a variety of scales.  In addition, while we focused on ZIP code-level granularity for this prototype, our technique could be straightforwardly modified to operate at the census block-level, providing even finer granularity.","By leveraging only open-source datasets and tools (specifically, the Tableau Public business intelligence dashboard tool), and making our dashboard freely available for others to download and modify (https://public.tableau.com/views/CaliforniaWaterQualityCensus/WaterQualityCensusDashboard), we believe we have adopted the spirit of reproducible research and open collaboration.","The largest challenge we faced was the technical hurdle of joining multiple different datasets that all operated at different temporal and spatial resolutions.  The resultant data pipeline is able to process hundreds of thousands of data points in real-time.  This real-time process of exploratory data analysis is critical to facilitating data mining, i.e., interactive exploration of a large, multi-faceted dataset.

In principle, our approach is capable of working with a wide variety of water quality data.  We would find it especially interesting to expand the scope from wells to public utility drinking water.",,"Well-Known_walkthrough.mov
Project_Website.pdf",checked,39.0,19.5
