0006,2021-02-01 15:08:14,HydroDetectus,Where’s My Water? : Predicting Renewable Freshwater Resource & Filling in Crucial Data Gaps,"In alphabetical order : Krishna Bhogaonker, Xiuyang Guan, Jose Gustavo, Benjamin Kinsella, Indrani Pal, Valerie Were","Team email: hydrodetectus@googlegroups.com; Individual: uc.krishnab@gmail.com,xiuyangguan@gmail.com,jgustavo@gmail.com,Kinsella.benjamin@gmail.com,indrani.pal@gmail.com,valeriewere@gmail.com","Los Angeles, CA (USA); Boston, Massachusetts (USA, Brazil, Princeton Junction, New Jersey (USA); New York City, New York (USA)","Develop a prediction system for and forensically reconstruct statewide renewable freshwater supply data, to help manage water risk in a timely manner - a system that is usable, dynamic in space & time, publicly-available-data-driven, reproducible, and time and resource efficient.",Mix of Open Source & Proprietary,"We are targeting “Improving the Quality and Usability of Our Data and Metadata” from the 4 challenge topics/questions.   Renewable freshwater resources (RFWR) are critical for managing water risk. While only 2.5% of the Earth’s water is available as freshwater, most of it is inaccessible to humans and only a tiny fraction of it is available in the rivers & streams as usable & renewable supply. As such, the flow of rivers is the best estimate of available RFWR. Globally, however, humans only use less than 10% of the annual discharge in rivers. Then, why is water scarcity still a problem? It is because the water is unequally distributed, both in time and space. In addition, this circulating resource, unlike any other, is heavily modified by climate and human abstractions. While water shapes our society, we shape our water resources.    In California, this challenge is particularly salient. In 2017, the state was still recovering from the recent mega drought, followed by a mega flood, which triggered failure at the state’s largest dam in Oroville and created havoc for emergency managers and planners. Such events will only get worse in the future. Researchers, government, nonprofit, and public initiatives, therefore, seek innovative approaches to help communities across the board deal with any such future events and avoid the negative consequences.    At its root, the problem is the availability of the right kind of data on how much water is available, where it is, and when to expect it. Will there be enough RFWR to grow crops? Where will wildfire fighters find RFWR to protect lives and property? Will there be additional failures to the ancient water infrastructure? River flow data in CA is sporadic. Less than 10% of the locations where we collect river flow data are “naturally flowing”. That means human influence  over 90% of the locations from which we are collecting data become practically unpredictable.  In addition, over 84% locations of the data collection sites across the state have some form of missing data. These data problems are real and need urgent attention.       Adopting an interdisciplinary framework, and using California’s State Water Project - one of the country’s biggest and best managed water sources - our team of subject matter experts, social scientists, and AI-modelers, conducted a year-long project to solve the puzzle. By leveraging a user-centered approach and state-of-the-art applications of Deep Learning, we developed a highly predictive tool and web applications for water managers to strengthen decision making, transform the sector, and identify opportunities for risk mitigation.","USGS streamflow data 
https://data.ca.gov/dataset/ca-usgs-watershed-boundary-dataset-12-digit-hydrologic-units
https://data.ca.gov/dataset/watershed-boundary-dataset-wbd
https://data.ca.gov/dataset/national-hydrography-dataset-nhd-archive
 
Climate data from different sources
Gridmet, PRISM, SMAP
climate.data.gov
 
Socio-economic datasets :
Water rights records
https://ciwqs.waterboards.ca.gov/ciwqs/ewrims/EWServlet?Redirect_Page=EWWaterRightPublicSearch.jsp&Purpose=getEWAppSearchPage
Water transfers
https://www.waterboards.ca.gov/waterrights/water_issues/programs/water_transfers/
State water contractor agencies
https://swc.org/about-us/
Fully Appropriated Stream Systems
https://www.waterboards.ca.gov/waterrights/water_issues/programs/fully_appropriated_streams/docs/fas_list.pdf
Water Rights Applications: Permitting and Licensing Program
https://www.waterboards.ca.gov/waterrights/water_issues/programs/applications/","Goals:
To improve the quality, usability, and reproducibility of RFWR data and data-enabled analysis per the Challenge
To develop a prediction system for RFWR and associated risk, which is usable, dynamic, publicly-available-data-driven, reproducible, AND time and resource efficient

The ability to predict and project renewable freshwater resources has many impacts, which include allowing
Water managers in cities and towns to plan for delivering drinking water to the almost 40 million Californians
Wildfire fighters to plan on where to draw water and where to stage equipment so they can save lives and property
Businesses, such as canoe rental companies, that depend on tourism to plan for their seasons
Farmers to understand how much water will be available for irrigation in a timely manner so they can continue to feed the nation 
Water quality monitors to estimate total maximum daily loads of pollutants, which reflect whether the water body meets standards for public health and healthy ecosystems.","Building and deploying a tool to predict renewable freshwater resources requires a multidisciplinary and systems change approach. This system approach, which examined the different elements and their interconnections, make our project compelling and well-positioned to achieve scale and impact. For instance, we have established interdisciplinary partnerships across the environmental, social, and physical sciences. Drawing from a range of theoretical and applied frameworks, we have developed a deep understanding of basic hydrology and the needs of stakeholders, namely water managers. We discovered through field work that water prediction for non-reference (human modified) water locations represents one of the main pain points for water managers, thus impacting decision making in a complex web of water-related initiatives. For this reason, our interdisciplinary and systems-based approach allowed us to discover innovative solutions that we believe will scale across hydrological systems, which exist across the globe.","First, we found that we could predict surface water flow much farther into the future than anyone else had done. While the US Forest Service and others make forecasts of up to 6-8 months in advance, our predicted data suggests we can comfortably predict one year into the future. Indeed, we can actually predict one, two or perhaps more years into the future. While there is more uncertainty the farther out the forecast, our models give users the ability to plan for date ranges that they could never access before. Think of the applications for more accurate future forecasts. Firefighters could better plan the placement of equipment to fight fires based on water availability in forest fire zones. Farmers could update their crop choice and planting decisions depending on whether to expect a wetter or dryer year. 

Second, we also found that we could forensically reconstruct the data from impaired or even abandoned surface water flow sensors. About 84% of all water sensors in California have medium to substantial data gaps. Those gaps rendered data from those sensors unusable for climate monitoring or analysis. But using our models, we reconstructed the data for sites with large gaps. Our outputs demonstrate the fine-grained accuracy of our data reconstruction. Using this treasure trove of additional data, we can refine our own forecasts and reduce the uncertainty in our predictions. Further, we plan to release these reconstructed time-series data to the public so that scholars may incorporate this data into their own research.

Our team is committed to public release and public use of our project results. The first component for public use is the interactive web tool, which is currently hosted on a simple Heroku instance. The tool provides a visual front end to display all of the sensor locations, as well as plots of the different model forecasts and data reconstructions. This tool allows non-technical users to locate their nearest sensors and review the surface water forecasts most relevant to their needs. 

Second, we also plan to release our forensically reconstructed sensor datasets for public use, once we have adequately benchmarked our results and allowed for peer review of our methods. However, once these two steps are complete, we look forward to contributing our data to the other publicly available natural resource data portals that inform governmental and business decisions around the State. 

Finally, once our data are publicly released, we plan to offer workshops for interested parties such as the USGS, the California Department of Water Resources, public utilities providers, and any other users interested in water availability in California.","Our team tackled multiple challenges, which serve as an exemplary case not just in California, but also around the world. For example, there are many challenges surrounding data quality and availability, which are prevalent in other hydrological systems all around the nation & world. Using state-of-the-art deep learning approaches to identify and augment available data sources was a critical step in building robust predictive models. Furthermore, this team showcases how solving these complex problems requires the integration of multiple stakeholders and social actors, including academics, researchers, government, philanthropy, among others. Getting everyone at the same table is a major challenge in the field. However, our team succeeded by building a nurturing environment for people with a diverse set of skills, which despite being  completely volunteer-driven maintained our relationships, support, and respect for each other's expertise. We believe that our team structure, organization, and governance could serve as an example for similar initiatives.",LinkedIn group : https://www.linkedin.com/groups/9024740/ ; Google group email : hydrodetectus@googlegroups.com; Google drive : HydroDetectus,"CWDC-Vid_try5.mp4
WaterDataChallenge2020-2021_TeamHydroDetectus.pdf",checked,41.0,20.5
0005,2021-02-01 06:28:56,SANTIAGO CABALQUINTO JR,USING SMART DRONES with ARTIFICIAL INTELLIGENCE TO KEEP OUR WATER SAFE,SANTIAGO CABALQUINTO JR,SANTIAGOJR@GRUMPYAMOEBA.COM,"LAKE ELSINORE, CA","AUTOMATED WATER QUALITY MONITORING, PROACTIVE ALERTS, AND FORECASTING MUST BE EFFICIENT AND ALSO COST-EFFECTIVE USING DRONES AND ARTIFICIAL INTELLIGENCE THAT WORK TIRELESSLY AND CONTINUOUSLY, 24/7.",Mix of Open Source & Proprietary,Autonomous data collection and reporting from air and water drones requires a lot of CPU and storage for aggregate monitoring and forecasting.  I need to speed up our AI.,"I'm using common data points, such as water temperature, detectible nutrients, heavy metals, chemicals, presence of algae, etc","Determine if the lake is safe for the public to swim, fish, and other water sports.  Have safety information available for the Lake and City manager, to be published on the city's website.","The AI + drone can provide ""almost-live"" status update every hour, including water forecast on a future city website.  ""Almost-live"" because the drones cannot fly continuously.  Drones need to be recharged.",Next steps are to remove the algae from the lake.,"I need more data points to make the public report meaningful for the public, lake, and city managers.  Make it user friendly like the weather report.  Get acceptance and feedback.",none,"PowerPoint_-_Grumpy_Amoeba_Business_Project_Plan_9-8-20_v1.pdf
PowerPoint_-_Grumpy_Amoeba_AI_and_drone_11-11-20_v1.pdf",checked,10.0,5.0
0004,2021-02-01 01:43:16,GreenInfo Network Organization and Community Water Center,Drinking water vulnerability tool,"Dan, Maegan, Stephani, Jayita, Saba, Amanda, Stephen, Tim, Tom, Gregor, Maria",gin@greeninfo.org,"Organization based in Oakland, California","A web-based application that puts key water data at the fingertips of the community, so members can explore, understand, and advocate for the safety of their water supplies.",Mix of Open Source & Proprietary,"The drinking water vulnerability tool focuses on the water data challenge of “Identifying and Understanding What Makes Communities Vulnerable.” The project shows that vulnerability is multi-faceted and can be analyzed at different spatial scales like county boundaries, Groundwater Sustainability Agency (GSA) boundaries, or well locations.  An estimated 1.5-2.5 million people in California rely on unregulated water sources (e.g., wells). These groups face two main vulnerabilities:  •	Vulnerability to water quantity changes: persistent droughts can lead to water scarcity •	Vulnerability to water quantity issues: lack of regulation and mobile cancer-causing contaminants (e.g., nitrates and arsenic from agriculture or industrial processes) can contaminate wells These vulnerabilities are further compounded by socio-economic constraints which can sometimes compromise all access to water.  This project fits in the broader California Data Challenge scope of “Assessing What We Know,” since it brings together a myriad of spatial data from many different California-based organizations to better understand different types of vulnerabilities. The tool helps communities better understand the locations of populations that may be affected by drought and water contamination.","Detailed descriptions of the different data layers can be found here: https://drinkingwatertool.communitywatercenter.org/data/
This list is a brief overview of the data layers and source or reference:
•	GSA boundary 
o	California Department of Water Resources SGMA Data viewer
•	Groundwater depth 
o	CDWR Groundwater Information Center Interactive Map Application
•	Groundwater basin prioritization level and critically over drafted indicator 
o	SGMA Data viewer
Boundaries and Demographics
•	County, Assembly District, Senate District, Alluvial
•	2010 US Census
•	Public Land Survey System 
•	Race, ethnicity, median household income, disadvantaged community status etc. for place, tracts and block groups
o	U.S. Census Bureau, 2013-2017 American Community Survey 5-Year Estimates.
Wells and Drinking Water Systems
•	Municipal or public supply wells 
o	Department of Water Resources’ Online System for Well Completion Reports 
o	Gailey, R. (2019) Public Supply Well Locations. CWC Drinking Water Tool.
•	Private Well Locations 
o	Department of Water Resources’ Online System for Well Completion Reports
o	Pace, C., Balazs, C., Cushing, L., Morello-Frosch, R. (2019). UC Berkeley Water Equity Science Shop. Domestic Well Community Boundaries Version 1.0.
•	Community water system boundaries 
o	Tracking California Water System Service Areas Tool
o	Pace, C., Balazs, C., Cushing, L., Morello-Frosch, R. (2019)  UC Berkeley Water Equity Science Shop. Community Water System Boundaries.
Water Quality
•	Water Quality (arsenic, nitrates, chromium, 1,2,3-Trichloropropane) 
o	California Office of Environmental Health Hazard Assessment’s (OEHHA) CalEnviroScreeen (CES) 3.0 dataset
o	Pace, C., Balazs, C., Cushing, L., Morello-Frosch, R. (2019)  UC Berkeley Water Equity Science Shop. Community Water System Boundaries- Water Quality. Pace, C., Balazs,
o	C., Cushing, L., Morello-Frosch, R. (2019)  UC Berkeley Water Equity Science Shop. Domestic Well Community Boundaries- Water Quality, Version 1.0.

Some datasets are results of calculations on the datasets. For example, to understand the drought scenarios, the groundwater depths from 2012-2016 are scaled by 0.5, 0.75, 1, where 1 represents the worst drought. Additional description of data and methodology can be found https://drinkingwatertool.communitywatercenter.org/data/","The first goal is educational. The tool enables users to learn and discover their water supply system. With a simple interface, the first tool just requires an address. This information allows the user to learn who manages water in their neighborhood and describes the different agencies that may be involved (community water systems, GSA’s). This section is informative for users to learn about maximum contaminant levels, consumer confidence reports and more generally get involved with local water issues.
The second goal is explorative.   With the web mapping tool, users can dive deeper into California's many water data layers. Different users can use the data to learn about water quality and water supply. 
This project is a collaborative, creative, and transparent effort to understand water vulnerability particularly with respect to wells in California. With access to the data, the user can quickly identify many types of vulnerability. For example, the user can explore spatially which community water system is serving disadvantaged communities (socio-economically vulnerable). The user can learn where declining groundwater elevations due to droughts can affect water access (vulnerable to water quantity changes). The user can understand where people are affected by different contaminants (vulnerability to water quality).
The tool has a feature for many different types of users. Policy and decision makers can use the tool to review groundwater sustainability plans and plan for drought resilient communities. Researchers can quickly download the data to run their own analysis. Furthermore, due to the myriad of data sets that are presented, the user can ask many different questions.","There are many unique features to this project and three to highlight include:

1 - Combining both water quantity and water quality data into one tool begins to showcase the different types of vulnerabilities that can exist and treats water more holistically 

2 – In a moment where society aims to understand how to be inclusive, particularly when discussing vulnerable communities, the Drinking water vulnerability tool has started to make inclusion a central part of data and design by accommodating the 2nd largest language spoken in the state (Spanish ~25%). The web page is available in both English and Spanish.

3 – The tool offers a feature for everyone, from the simple educational information of who provides the user water to the deeper-dive with many data layers combinations and research questions, the tool can serve a very broad group of people and help them better identify water vulnerabilities for other and for themselves.","Despite living in CA for a long time, it wasn’t until using the tool, that I learned who my water providers are and saw that the quality of my water was quite reasonable without a need to worry about levels beyond the regulation of As, N, Cr6 and 1,2,3-TCP. However, in exploring the deeper dive, I could not say the same about Joshua Tree National Park and Twentynine Palms which has high levels of Hexavalent Chromium (cancer-causing) contamination and are classified as disadvantaged and severely disadvantaged areas.

The drought scenarios are applied in the Alluvial Boundary and we can see the impact of increasing drought severity in Fresno, Merced, and Modesto. These cities are already in critically over drafted basins. By looking at the GSA level scale we can see how the number of impacted domestic wells changes with different scenarios with both Merced and Modesto reaching number of impacted wells at more than 26 the highest category at scenario 100% and Fresno already having this designation at the scenario 50%. With respect to quality, we can explore Arsenic near Mercer where it is present in both community water systems and to a greater extent in groundwater private domestic wells. Atwater just north of mercer seems to have 1-2-3 Trichlorpropane contamination in both community water systems and in private domestic wells at levesl more than 200% the MCL. This area is predominantly Hispanic/latinx. 

Exploring the city of Atwater offers insights on the relationship between vulnerability and equity since the user can compare the areas that have regulated community water systems and associated 1-2-3 Trichloropropane levels and the surrounding unregulated domestic wells and their associated contamination. Furthermore, the stark distinction in income suggests part of the different may be socio-economic.","Challenges encountered during the project included:
1 – Aggregating wells to comply with privacy concerns.  Although well data was often available at higher resolution, it was important to aggregate well to US Public Land Survey Systems. This also enabled a calculation of likelihood that an area was served by a well when no well location was available.
2 – Identifying the right audience. One of the difficulties is identifying who the audience and users of the tool will be. This project aimed to build a tool for the general public, but this group may include advocates, policy-makers, researchers. This requires designing different features for different users. Consequently, building something for a general public is the most complicated tool of all to build!",Twitter: @greeninfo,"Water_Data_Challenge_Final.mp4
CWC_Drinking_Water_Tool_--_Part_1_--_Spanish.pdf
CWC_Drinking_Water_Tool_--_Part_1.pdf
Water_Data_Challenge_DeepDive_Atwater.png",checked,,
0003,2021-01-30 00:03:22,New Mexico - Clean Water,Water Vulnerability in New Mexico,Wesley Chioh; Ana Gomez Lemmen Meyer,wes.chioh@gmail.com; analourdesglm@gmail.com,,"Visualizations that quantify and identify the degree to which communities are vulnerable to threats to their drinking water supply, and intersectionality of systemic socio-economic environmental disadvantages.",Open source (components used to produce the result are freely available for distribution and modification),"The U.S. Federal Government under the Trump administration changed the interpretation of the Clean Water Act, thus affecting the protections afforded to waterbodies classified as Waters of the United States. What is unknown, however, is the degree to which communities in New Mexico would be affected by such a change.","US Census Bureau data, New Mexico Water Data Initiative",Empower citizens and policymakers to identify communities and water bodies that are most vulnerable to changes to the Act's interpretation.,"1) Created a new Drinking Water Vulnerability Index to rank the Risk to Public Water Systems' Water
2) Adapted United Nations Development Program's Human Development Index from evaluating countries to evaluating each county in NM 
3) Enables policymakers to pinpoint potential policy shortfalls at various levels of state and local government 
4) Visuals were designed in consultation with NM state government officials to ensure that data products designed meet their needs","1) NM state government officials have responded favorably and enthusiastically to our products. Our dashboard and story map are now hosted on state government servers and openly accessible to the public. The hope is that educators and local policymakers will start to adopt the resources created for their use! 
2) An open-source code repository on Github was created to facilitate collaboration, sharing, and reproducibility. 
3) We have managed to identify communities and public water systems that are at particular risk due to the intersection of socio-economic disadvantages and environmental injustice.","1) Getting up to date data at the appropriate scale (2020 census tract-level Census Data for example) 
2) Translation of dashboard and story map to Spanish will expand accessibility to Spanish-speaking Latinx population in NM 
3) Measure additional risks in index such as impacts to groundwater 
4) Estimate the costs of switching from federal to state oversight",,SubmissionLinks.txt,checked,50.0,25.0
